good morning friend hope terrific thursday waste time angry happy,2
top reason kid get angry best playschool parent little kid angry child kid learn isf un ta,2
vote next election creep joe bid en goin party goin,2
people enjoy meme never react thursday thought pakistan thursday morning angry depression,2
apoplectic ban bit beach boo find ang,2
destroy statue liberty mount rushmore satisfied angry,2
injured cash wrestling wisconsin independent two river player club injured angry,2
joe cocker beautiful via play loud feel pai,2
joe cocker beautiful via play loud feel,2
eff heartbreak angry kane ki tokyo boul fuck,2
covid cat run beard man angry face,2
alienate alone angry digital revolution alienate alone angry,2
check angry bird star war telepods lando calrissian bird qr code hasbro via,2
think angry cause make series yet uniform cute girl angry,2
check angry bird star war telepods royal guard pig qr code hasbro via,2
check angry bird star war telepods han solo carbonite qr code hasbro via,2
check angry bird star war telepods padme amidala bird qr code hasbro via,2
come okay bull shit tire stupid people need new people life angry,2
day pas sanity faith humanity long go know fact redact word,2
feeling visitor let come go mooji mental health anger negativity worry suffer worry,2
feeling visitor let come go mooji mental health anger negativity worry suffer,2
want listen one direction already heard several time angry,2
stop attack karen people mother name argh angry,2
say karma would get dish get angry wiff human hurt dog,2
get bit neck mosquito look like world big fuck pimple itchy hell grr angry mosquito,2
hate mad ill kill angry furious,2
help get art publish come vote click want one galveston texas,2
hey sir right truck bin wastetruck driver nah get earlier crackhead,2
happy help year old lady get rid garden today carry put cl,2
talk pop time doesnt get old cut shenanigan,2
happy not angry,2
happy not angry,2
universe get shit like firebenders ninjutsu ki stand alien pokemon super power universe,2
apoplectic ban bit beach boo find ang,2
make angry,2
apoplectic ban bit beach boo find ang,2
actual hell wrong people go people mind make think okay,2
apoplectic ban bit beach boo find ang,2
apoplectic ban bit beach boo find ang,2
apoplectic ban bit beach boo find ang,2
not slave mood master angry depressed sore spirit canno,2
not slave mood master angry depressed sore spirit,2
negative everything bloody hate mental health mental illness negativity angry depression anxiety,2
apoplectic ban bit beach boo find ang,2
ani old animation make giggle justin asch animation funny giggle grill cheese cooking silly cute,2
feel lose mum end two week short th birthday today go fa,2
apoplectic ban bit beach boo find,2
reason kira get eliminate never come back deserves manifest dark en,2
apply boy girl get soooo angry uncomfortable girl friend,2
beatnet gotta see shit everyday gotta get angry everyday tire,2
sell stuff ac nh ebay hope hunt,2
perman hater want per man want pet man india want per man india love per man india support,2
aaron richards husband seem angry little,2
cut son hair lockdown say happy understatement lock parent,2
know friend feel like no one talk shit go head unknown ignore tag,2
hate unimportant people important unknown tag sad told sad damn depress io,2
know friend feel like no one talk shit go head unknown ignore tag,2
happy help year old lady get rid garden today carry put th,2
make angry make feel cross tell different way describe feel,2
mun shu hot star live online platform show goalrush cover every game played mere sma,2
reason keep thing cause im not good explain tag sad told sad damn depression,2
daddy issue kid angry money find love,2
apparently much care business see left dark since may sent,2
pls open gym health crisis mentally physically gym help pub,2
anger like smoke tell something burning get angry use opportunity see wha,2
anger like smoke tell something burning get angry use opportunity see,2
cancel culture help fix pain inside heart anxiety angry world,2
cancel culture help fix pain inside heart anxiety angry world,2
reason keep thing cause im not good explain tag sad told sad damn,2
really feel pain ur heart something really hurt tag sad told sad damn depression,2
perman hater want per man want pet man india want per man india love per man india support,2
actress sunny leone red saree angry hd wallpaper actress sunny leone saree angry wallpaper phone android,2
apparently much care business see left dark since may sent,2
apparently much care business see left dark since may sent,2
apparently much care business see left dark since may,2
see horrible story outrageous disgust behaviour totally not acceptable,2
truth set free first piss various attribution eart ace quote,2
spent hour try contact reference number site not recognise system,2
leave twitter find eventually remove no place believe proces,2
kame shut no fant angry angry turtle turtle turtle,2
see horrible story outrageous disgust behaviour totally not acceptable,2
say someone make angry excuse lack self control mindfulness motivation,2
ever use product highly dissatisfied keep see advert everywhere turn,2
arsenal football corporation club destroyed fact kr en keout miss arsenal tuesday thought,2
june time get angry word action past sometimes angry,2
not good place today feel really angry no job see future face,2
angry racist,2
tire help,2
see horrible story outrageous disgust behaviour totally not acceptable,2
see horrible story outrageous disgust behaviour totally not acceptable,2
yup standard liberal fat angry ugly,2
see horrible story outrageous disgust behaviour totally not acceptable,2
see horrible story outrageous disgust behaviour totally not acceptable,2
see horrible story outrageous disgust behaviour totally not acceptabl,2
would interested app allows search meme multiple hashtags frog green angry,2
animaladvocate wldlife,2
manage get track number courier none work site ffs,2
pier morgan could challenge beauty salon sole trader cannot open pub ppe,2
way say angry visit post learn english learn english online,2
ok ok think everyone moment studio right no idea mad haha angry,2
look like bowsette much care bubble maybe hot air balloon one request bling,2
happy internation emotion day happy sad angry right express emotion,2
publish june stream angry rant lol literally not care sorry not sorry autism,2
perman hater want per man want pet man india want per man india love per man india support,2
angry today sick lie liberal corrupt evil look image look,2
ep fabio cherant right angry via fight story fabi ocher ant angry fighter,2
fam make mad end year streak away twitter customer service crap move,2
perhaps people look thing start panic especially unsettle time tha,2
lie lose package lie say look lie ignore,2
lie lose package lie say look lie ignore,2
lie lose package lie say look lie bein,2
seriously think broke something foot four finger play basketball,2
go live pm cdt plan ruin rain join link bio dj dj mix live twitch mix,2
think angry cause make series yet uniform cute girl angry,2
watch episode se angry boo boo tv time,2
never respond angry never make promise happy never make decision,2
people experience make angry personal growth,2
mindful thank amaze resource use time toolkit snuggle bu,2
really finity internet issue issue week upload speed drop,2
people fed trump isa laughingstock trump haitian life matter black life matter,2
people experience make angry,2
make angry disappointed cut stake high,2
people patriot digital soldier community want country back deep st,2
random angry guy happens tough sketch tough guy angry comic art artist draw,2
else notice handle grab cloth angry,2
no fecking idea love way save mum car trip man doh angry cctv wtf th confuse,2
think angry cause make series yet uniform cute girl angry,2
salt salt sir live lou la tofu twitch streamer,2
someone explain pub reopen not gym pint important hour fitness,2
request refund may cancel flight today receive email advise voucher raise,2
would interested app allows search meme multiple hashtags frog green angry,2
cat cat food angry,2
angry time angry know try mix hot water cold water try separate,2
donnie let help something seem get pretty easy keep stupid thing say,2
perman hater want per man want pet man india want per man india love per man india support,2
think angry cause make series yet uniform cute girl angry,2
think angry cause make series yet uniform cute girl angry,2
angry tire nice want go apeshit,2
patient milton learn take moment not act anger www askdrwoodchuck com,2
angry tire nice want go apeshit,2
angry tire nice want go apeshit,2
think angry cause make series yet uniform cute girl angry,2
think angry cause make series yet uniform cute girl angry,2
think angry cause make series yet uniform cute girl angry,2
angry tire nice want go apeshit,2
katie hopkins block twitter brilliant reliable lovely woman reporting,2
categorize black queen angry wow el oh el,2
not slave mood master angry depressed sore spirit,2
angry bird transformer app ape review game dev indie dev robot transformer,2
angry bird transformer app ape review game dev indie dev robot transformer,2
angry piss frustrate hurt broken tire heal recover pick piece refuse lose,2
katie hopkins block twitter brilliant reliable lovely woman reporting,2
much angry day,2
katie hopkins block twitter brilliant reliable lovely woman reporting,2
honest hurt ignore tag sad told sad damn depression fear happy feeling issue relatable angry qu,2
moment angry express angry heartbreaking,2
la tofu make cry chill angry,2
angry heartbreak consume everything good change make today everyone,2
unlock bfbbr steam angry,2
felt hopeful really clear useful call nurse gp call mansplains illness,2
hb hak wont utter word know ahab angry,2
tire help,2
angry mom training school angry mom trading schooltime shoe funniest tweet funny edit emes,2
check isabella video ik tok girl period give angry angry girl period problem period,2
cynical part critical people behavior choice furious angry,2
order controller week ago tellin white honey comb available nee,2
society come blame reverse descend order medium high education,2
government allow place make money open no gym joke know many gym,2
today one cop george floyd case confront angry shopper say,2
see credit card hand angry,2
one child return day week primary soon th year son school,2
rush around since get paperwork wont give go lose shit today,2
would interested app allows search meme multiple hashtags frog green angry,2
feel stress angry listen music alters brainwave science melt anxiety stress,2
perman hater want per man want pet man india want per man india love per man india support,2
would interested app allows search meme multiple hashtags frog green angry,2
resist orbis baggins,2
fairly outrage never get outrage one polling polling place mile town,2
would interested app allows search meme multiple hashtags frog green angry,2
activity angry worried kid,2
perman hater want per man want pet man india want per man india love per man india support,2
moment angry white man explodes black mother block mailbox living life via,2
complain bad sale operating skeleton staff answer phone angry ustoner,2
show anger via must watch anger love islam anxiety sufism dep,2
show anger via must watch anger love islam anxiety sufism dep,2
show anger via must watch anger love islam anxiety sufism dep,2
make full version angry mickey mouse knock loose,2
make full version angry mickey mouse knock loose,2
show anger via must watch anger love islam anxiety sufism,2
get angry watch news angry reporter talk angry people perform angry act neo marxi,2
perman hater want per man want pet man india want per man india love per man india support,2
understand get broken freak nowhere numb angry heartbroken,2
seem upset draw sketchbook sketch animal fox pencil sketch illustration character design angry thro furry,2
anger cause many health problem not kept check important aware take action,2
dear cop good cop proud good cop still outrage disproportionately,2
anger cause many health problem not kept check important aware tak,2
well redd come today get really excite look art realize art,2
think angry history might survive baka da,2
choose wisely angry insult mad,2
even small kid angry scold china pla kill indian soldier boycott china,2
punch bag not piece cloth fill sand use see red want get everyth,2
choose wisely angry insult mad,2
like goal others despise feel bad anyone dea,2
make smile angry right smile angry happy sad inone day lisa simpson stay safe st,2
make smile angry right smile angry happy sad inone day lisa simpson,2
publish june stream angry rant lol literally not care sorry not sorry autism female autism,2
stop violence control emotional outburst anger angry,2
stop violence control emotional outburst anger angry,2
stop violence control emotional outburst anger angry,2
stop violence control emotional outburst anger angry,2
choose wisely angry insult mad,2
angry look cat supervises watermelon thailand love community trend,2
happen talk know real know real trust apa,2
tweet angry disgruntledemployee shuffle clown,2
trust police course twitter no way ignore,2
anti road rage spray available good bike shop might need buy one though dash cam cctv,2
anti road rage spray available good bike shop might need buy one though dash cam,2
not slave mood master angry depressed sore spirit,2
swan ft mud look thread tweet lmao wait elle brooke flash ti,2
get good insult ready next time get angry people online,2
break news trump sun well need house dems start thenwatch,2
break news trump sun well need house dems start thenwatc,2
shut fuck dad not dance dance revolution kpop ugh angry pop,2
angry deject embarrass trump return home disaster standup comedy rally full,2
angry gamer noise emes emes daily monday mood monday mood funny joke laugh relate relate able,2
woah bro believe angry sister broooo,2
total lack realisation work teacher school around remote learn som,2
frenkie de jong annoyed barcelona medical staff wrong first diagnose injury,2
turn negative experience positive one constantly learn cause negative emotion customer exp,2
would interested app allows search meme multiple hashtags frog green angry,2
behold wall gammon angry white men,2
help lose business saturday change device download app,2
phone wait hour customer service problematic dishwasher installation not bosch,2
behold wall gammon angry white men,2
would interested app allows search meme multiple hashtags frog green angry,2
wait day phone call never happen ok dont needvny medication anyway angry mental health,2
perman hater want per man want pet man india want per man india love per man india support,2
perman hater want per man want pet man india want per man india love per man india support,2
happen talk know real know real trust apa,2
would interested app allows search meme multiple hashtags frog green angry,2
please see recent reply angry,2
meany golliwog cute brown person say gt angry,2
happen talk know real know real trust apa,2
road rage road rage bikers bike car angry,2
miss send application cv interview feedback sorry experience education not soc,2
set scene worth melancholy movie different bride wedding decor wedding dress,2
miss send application cv interview feedback sorry experience education not,2
would interested app allows search meme multiple hashtags frog green,2
set scene worth melancholy movie different bride wedding decor,2
infuriate angry thing anyway matter time head roll campaign,2
gm bible study luke son blind man address jesus torn anger love possible,2
tire help,2
even america anymore elderly shove child gas le fortunate,2
even america anymore elderly shove child gas le fortuna,2
mindful thank amaze resource use time toolkit sn,2
bha kt generation gap mouth common sense angry,2
bha kt generation gap mouth common sense angry,2
happen talk know real know real trust,2
gm bible study luke son blind man address jesus torn anger love possibl,2
angry bird ii album main cover forget drop th july,2
free film father murder robin williams death single father two nearly jump bridge standup comedy,2
angry deject embarrass trump return home disaster standup comedy rally full,2
free film father murder robin williams death single father two nearly jump bridge standup,2
stella angry bird stella angry bird movie angry bird,2
love go holiday afford still wait refund three previously cancel flight angry,2
want something put ur mind tag sad told sad damn depression fear happy feeling,2
make angry wtf racism like light show shit like happe,2
angry deject embarrass trump return home disaster standup comedy rally full,2
stupidity low iq crawl rock make think powerfu,2
not gonna vote really black man assault group angry white men way vote,2
thought angry look twitter angry,2
know constantly angry man risk verbal abuse physical abuse wonder make hi,2
angry deject embarrass trump return home disaster standup comedy rally full,2
bollock hospital call another piss telephone consultation thursday bloody useless,2
feel like banging head brick wall come one phone call could resolve everythin,2
else notice jerusalem go every kind mood calm angry happy diver state mood etc,2
blimey betty follow honour suggest take pant,2
please sort quick take money time no reply angry bad customer service,2
please sort quick take money time no reply angry bad customer service,2
free film father murder robin williams death single father two nearly jump bridge standup,2
george flyod police hear scream day world hears rest peace new,2
john bolton man scorn become bitter angry dangerous bad,2
seem upset draw sketchbook sketch animal fox pencil sketch illustration character design angry,2
get angry accept submit injustice thrust upon,2
fuck look dog soft witter dog mean angry,2
little angry girl know reason anger make beautiful like draw ex,2
anybody else feel dominic cun ming go drive people angry thrown shelter,2
leaveeee dotn even say bro ur sick scene angry fuck mad,2
not mad angry connive man bolton bolton book bolton interview pirate edition john bolton,2
tame monster angry egotistic grateful positive vibe stay safe,2
monday morning bad share moan moanrantwhine rant whine moan moan day angry fed tweet,2
full broken thought cannot repair tag,2
fuck people tag sad told sad damn depression fear happy feeling issue relatable angry quote,2
im broken think unknown tag sad told sad damn depression fear happy feeling issue,2
someone say im tire please check mentally tire ik tag sad told sad damn,2
busy ghost forgot home tag sad told sad damn depression fear happy,2
hate unimportant people important unknown tag sad told sad damn,2
imagine lose ur best friend hit bad lose ur partner tag sad told sad damn depression,2
anyone else get attention white crayon tag sad told sad damn depression fear happy feeling,2
anyone else get attention white crayon tag sad told sad damn depression fear happy,2
honest hurt ignore tag sad told sad damn depression fear happy feeling issue relatable,2
know friend feel like no one talk shit go head unknown ignore,2
type anger one angry inspiration,2
im go take time twitter cant right trigger hurt angry,2
mayor sends hatchet man stooge cpd reformer nope anything distract crappy job rioter,2
sorry dick bro would mad pay hooker lie angry everythi,2
not clean cant stay aunt selfish take take make,2
animal cross version doggo make friend want angry pup computer,2
look octopus relax octopus red stuff animal cute,2
angry word shard glass wound cross path elder lenore aar ti la art,2
anger translator funny clip note contains swear angry funny people online http,2
anger translator funny clip note contains swear angry funny people online,2
dear cop good cop proud good cop still outrage disproportionately,2
dog smell corona virus via mall church angry conspiracy comedy film,2
uh puppy puffy charm web comic pixel comic couple comic ig comic digital art marshmallow sketch,2
feel time angry defeat want happy,2
uh puppy puffy charm web comic pixel comic couple comic ig comic digital art marshmallow sketch,2
uh puppy puffy charm web comic pixel comic couple comic ig comic digital art marshmallow,2
song angry today,2
bother play follow unfollow game always block angry,2
notice many angry post many time angry hiding fear anxiety underneath,2
notice many angry post many time angry hiding fear anxiety underneath,2
violence could maybe reflect feel way reach mental health counselor,2
michelle obama encourages graduate increase activism beyond hashtags ever let anyone tell th,2
hold two separate thing mind lovely family wonderful life irritate,2
dear cop good cop proud good cop still outrage disproportionately,2
hollman travis take article anything positive right twitter,2
trump suspect chinese role coronavirus creation time indian cod mr rawat state not lab,2
mr president angry madness go around country consititution,2
take fuck rubbish home dartmoor litter litter pick dartmoor national park angry furious huma,2
take fuck rubbish home dartmoor litter litter pick dartmoor national park angry furious huma,2
take fuck rubbish home dartmoor litter litter pick dartmoor national park angry furious,2
say provoke parallax anything wrong fault lexia pi,2
con unfortunately proud need see con realis,2
gutted cruel nasty person slash two tyre seriously people nothing well time sad angry,2
dear cop good cop proud good cop still outrage disproportionately,2
find angry would anyone destroy historical statue would anyone say,2
never respond angry never make promise happy never make decision sad,2
cat box sunday catbox car altercation wheel drive icecream truck cat soft witter cat catur day dr,2
howay ref man pre season friendly book foul man angry ufc,2
cancel email hell go angry,2
dear cop good cop proud good cop still outrage disproportionately,2
ten year toxic tory angry hell dont leave challenge,2
cat box sunday catbox car altercation wheel drive icecream truck cat soft witter cat catur day dr,2
love friend lauren not tell get hair extension angry,2
friend mine work nh told nightingale hospital actually,2
social medium platform grow right wing racist move drove far right ed,2
cat box sunday catbox car altercation wheel drive icecream truck cat soft witter cat,2
michelle obama encourages graduate increase activism beyond hashtags ever let anyone tell th,2
know today thousand feel like father day angry late lock,2
swear search destroy make mad angry call duty modern warfare game,2
whilst strong feeling commission not monopoly consider android,2
angry aft yr leave mohamed title terrorist smore holier thn ldo big ian,2
angry aft yr leave mohamed title terrorist smore holier thn ldo,2
ya jeppa understand lucky get season without player test positive,2
kajifa daman nii ansanni da mlsn mangawa stop co love arewahome,2
anybody become angry easy angry right person right degree rig,2
happy person angry citizen lewis black simply standup happy angry emotion citizen,2
dear cop good cop proud good cop still outrage disproportionately,2
fact many teacher paid little underpaid work crazy hour buy thing class roo,2
sick allow page try claim hate new try hussle,2
come watch get even salty last la tofu salty angry twitch,2
dear cop good cop proud good cop still outrage disproportionately,2
dear cop good cop proud good cop still outrage disproportionately,2
black brother sister see use democrat run nothing hate black life mat,2
razdan dear soni thank easily call hate mean well pr post ur timeline defi,2
kid judging tone learn create school home discrimination teach em one thing hate,2
hate crime rise white see anybody cabinet restaurant depart,2
support support trump trump racism white supremacy hate evil dump trump,2
watch eat gelato show writhe anger hate anger,2
si mean go strugfle account im fonna cry hate word,2
hatewatch cnn allow hear pro white protester actually say blm protester cnn call,2
san jose man charge hate crime assault incident santa cruz jun et,2
matter common interest national progress pubilc welfare everyone business espons,2
look vig family like every bmw save many car bmw family swedish crew love,2
facebook continue make record set profit yet also continue ignore hate extremism platform time,2
hate crime rise white see anybody cabinet restaurant depart,2
immasculating feminity vulgar abusive aggressor unacceptable hate program abuse ten,2
verizon pull ad face book inaction hate speech,2
prince harry meghan markle reach allege hate crime victim jun et,2
say no hate speech respect respect hate speech hate,2
hate crime rise white see anybody cabinet restaurant depart,2
hate crime rise white see anybody cabinet restaurant depart,2
ask al sharp ton leave tray von martin sanford fla rally openly demandi,2
ask al sharp ton leave tray von martin sanford fla rally openly,2
hate crime rise white see anybody cabinet restaurant depart,2
hate crime rise white see anybody cabinet restaurant depart,2
hate crime rise white see anybody cabinet restaurant depart,2
facebook continue make record set profit yet also continue ignore hate extremism platform time,2
kag,2
hul news surf excel hate like cancer spread hmm please,2
news surf excel hate like cancer spread hmm please dm yo,2
dude part problem peddle hate bigotry divisiveness elsewhere nazi,2
news surf excel hate like cancer spread hmm please,2
stop hate altogether,2
trump death surge june dead million infect cultist covid rally no virus defense plan,2
trump death surge june dead million infect cultist covid rally no virus defense plan,2
