company tell facebook time stop hate profit today mark zuckerberg respond small change th,2
life matter alternative racism hate kind espouse,2
hate system not choose part really believe evil gotta talk ab,2
white people new jew radical left facists anti fa not happy earth purge,2
macro feminology poem poetry poet audio art word wordsmith artist writer publisher hate love,2
kag,2
nasty hey know many others held office yr,2
report racist instagram get reply follow kid shame racism hate,2
openly anti semitic homophobe nothing honorable shame fox,2
black people defend race not afraid beta ward covid trump traitor,2
another example facebook continue ignore hate platform along partner,2
sharon sandler twitter follow fierce brave unashamed anti racist antifascist,2
want divide want hate anyone remember last time happen,2
facebook continue make record set profit yet also continue ignore hate extremism platform time,2
bill cosby held comedy skit church preacher use,2
wap washington post racism form voice thru press liberal walkaway democrat,2
try love put pressure marlee flex microphone marlee ah dmv photography,2
simple twist poem poetry poet audio art word wordsmith artist writer hate love,2
like operating systemic racism hate,2
get nice idea mute word twitter timeoine asan hope feed timeline peace,2
society see woman equal stop kill men unrealistic standard accept ind,2
life matter alternative racism hate,2
reset saturday question day hate love dead pool wolverine,2
yes really work,2
self described marxist feed full hate believe right deserve die,2
life matter alternative racism hate kind espouse,2
life matter alternative racism hate peace,2
starbucks late say pause social medium ad story source photo via new york post,2
political figure like gop also pledge stop hate profit facebook platform month,2
openly anti semitic homophobe nothing honorable shame fox,2
satanist socialist democrat try destroy america sinc,2
chan zucker berg initiative czi reputation laundering organization facebook make billion violate,2
haaaaaaaaaaaaaaaaaaaaaaaaaate play abby tlo hate hour slater,2
unprovoked attack santa cruz sunday morning investigate hate crime jun pm et,2
hate loud,2
hate democratic party deafen democrat hate,2
way no need music tube hate distress rock itunes free girl anime depression,2
yahweh elohim jesus et al please bless awareness discipline refrain avoid thin,2
today pride still alone part family evangelicals trump even brought boyfrie,2
blame belongs corrupt trump corrupt penny trump administration fake fox news lie misinformation,2
macro feminology poem poetry poet audio art word wordsmith artist writer publisher hate love,2
facebook continue make record set profit yet also continue ignore hate extremism platform time,2
facebook continue make record set profit yet also continue ignore hate extremism platform time,2
political figure like gop also pledge stop hate profit facebook platform month,2
ha white new obsess black ha white isth enew black blm obama legacy hat,2
watsontown pa go find twitter want attention give expose racist hate blm,2
political figure like gop also pledge stop hate profit facebook platform month,2
awful lot hate negativity foment social medium day refuse part,2
reset saturday question day hate love dead pool wolverine,2
omg hate racist people look like black life matter,2
repent wicked way come nasty stench hate take breathe bu,2
people might hate mayo lol,2
pride come end never stop brave others speak others suppo hate,2
facebook continue make record set profit yet also continue ignore hate extremism platform time,2
post online hate cost life israeli company offer way,2
facebook continue make record set profit yet also continue ignore hate extremism platform time,2
thing motivate hate fear police stop hat american american,2
thank duke duchess sussex dedication end hate online especially important,2
thank duke duchess sussex dedication end hate online especially important,2
hate crime rise white see anybody cabinet restaurant depart,2
dior frame mi shade blockin floridian hate,2
none coward attack community would direct hate towards jew mu,2
no one unhappy today love america day left love hate,2
hate much blind open blatant racsim like replicate donald trump,2
case not clear employee sick racist chevron racist hate,2
fuck bernie ijs bernie reason even know thankyou bernard sander love hate,2
use face book financing hate racism big disinformation campaign human history,2
hat people like burning house get rid rat harry emerson fosdick hate burning house,2
people say hate strong word love people throw around like nothing team follow back,2
damn trump son poacher billion hate greed starstruck fuck greed gaz zl er,2
full false claim hate lie,2
another example facebook continue ignore hate platform along partner,2
mumma not public office resign spiteful nasty behavior glimmer soul,2
bill cosby held comedy skit church preacher use,2
thank duke duchess sussex dedication end hate online especially important,2
no idea karen quick lesson karen generally define,2
texas cypress white power flyer houston jesus jewish socialist christian love one another,2
pride come end never stop brave others speak others suppo hate,2
pride come end never stop brave others speak others suppo,2
news,2
san jose man charge hate crime assault santa cruz jun pm et,2
even one look like hate crime fbi,2
thank stop hate profit face book hate,2
ya know really hate constitution bring slavery thing discredit founder,2
underachiever always go hate,2
hate macedonian get canada exist no ethnic group subject cdn medium report,2
hate big business enough money love buyout hate,2
truth confederacy united state full version via hate business,2
trump death surge june dead million infect cultist covid rally no virus defense plan,2
facebook continue make record set profit yet also continue ignore hate extremism platform time,2
muslim woman say gay lesbian kill muslim woman american congress,2
not american like clinton like obama still want,2
fault socialist democratic party take democrat medium hollywood,2
facebook continue make record set profit yet also continue ignore hate extremism platform time,2
salty hate,2
canon rain test filmmaking short film indie film filmmaker race dream independent medium movie sport,2
another example facebook continue ignore hate platform along partner,2
prejudice something something taught bruce bruce simply standup,2
not sure dems hate america patriotic citizen not sure alternative fact protect constitution vote dems htt,2
medal freedom available bailey via stream service hip hop,2
powerful image world face america value america fact value hate,2
hate macedonian get canada exist no ethnic group subject cdn medium report,2
winona ryder talk experience hollywood antisemitism winona ryder mel gibson,2
hate macedonian get canada exist no ethnic group subject cdn medium report,2
freeway racist california monument los angeles time systemic racism homelessness,2
facebook continue make record set profit yet also continue ignore hate extremism platform time,2
whatsapped death threat harassment intimidation hate crime noise pollution public,2
people hate achieve life want make no effort,2
hat people like burning house get rid rat harry emerson fosdick hate burning house,2
thank duke duchess sussex dedication end hate online especially important,2
openly anti semitic homophobe nothing honorable shame fox,2
openly anti semitic homophobe nothing honorable shame,2
speaker pelo si sen schumer hate america loose not vote answer god,2
hate macedonian get canada exist no ethnic group subject cdn medium report,2
hate macedonian get canada exist no ethnic group subject cdn medium report,2
brinda get deep pocket go along deep hatred put bid trip africa,2
hate tick suck stop not worry camp outdoors follow,2
nm hate group awful enough state,2
sadly current believe people good people disagree,2
facebook continue make record set profit yet also continue ignore hate extremism platform time,2
facebook continue make record set profit yet also continue ignore hate extremism platform time,2
facebook continue make record set profit yet also continue ignore hate extremism platform time,2
facebook continue make record set profit yet also continue ignore hate extremism platform time,2
facebook continue make record set profit yet also continue ignore hate extremism platform time,2
facebook continue make record set profit yet also continue ignore hate extremism platform time,2
facebook continue make record set profit yet also continue ignore hate extremism platform time,2
hate crime dead man shoot crowd breonna taylor protest louisville,2
reset saturday question day hate love dead pool wolverine,2
consider hate group daddy anti fa domestic terrorist anti fa japan even try trend,2
harshest thing ever tweet wa,2
hate crime dead man shoot crowd breonna taylor protest louisville,2
awful lot hate negativity foment social medium day refuse part,2
go spontaneously combust one day soon hate,2
thank duke duchess sussex dedication end hate online especially important,2
black brother sister see use democrat run nothing hate black life mat,2
getter noonan revolution slavery godless nation tha,2
trump death surge june dead million infect cultist covid rally no virus defense plan,2
facebook continue make record set profit yet also continue ignore hate extremism platform time,2
political figure like gop also pledge stop hate profit facebook platform month,2
trump sake god go donald trump antichrist,2
thank duke duchess sussex dedication end hate online especially important,2
end day sign america global delusion hate gt false truth fall church gt occultism ritual child sacrifice gt ab,2
normal hate someone hate,2
another reason short hell fb zucker berg think mea culpa panacea erase many,2
facebook continue make record set profit yet also continue ignore hate extremism platform time,2
not public office resign spiteful nasty behavior glimmer,2
new tune soon great hate,2
tre racism hate sum,2
urgent call action legislator interested party kill bill poli hate discrimination http,2
another example facebook continue ignore hate platform along partner,2
facebook continue make record set profit yet also continue ignore hate extremism platform time,2
trump death surge june dead million infect cultist covid rally no virus defense plan,2
facebook continue make record set profit yet also continue ignore hate extremism platform time,2
well no worry affluent black woman step support best potus,2
hate evil good hate evil good right action truth theology philosophy yaakov ben ye ho hua,2
salt lake city pt hate gether fire,2
company tell facebook time stop hate profit today mark zuckerberg respond small change th,2
pt hate gether fire,2
hate gether fire,2
thank news join ad pause facebook tell,2
pointbc ntologist nazi ex,2
facebook continue make record set profit yet also continue ignore hate extremism platform time,2
kind hate anti fa us make slave people slavery,2
point would argue knowingly continue support ra,2
not afraid people say trump,2
hate speech not part free speech unless hate crime lifestyle choice racism crime racism america ra,2
hate tick wish would disappear stop not worry,2
trump death surge june dead million infect cultist covid rally no virus defense plan,2
hate tick wish would disappear stop not worry,2
facebook continue make record set profit yet also continue ignore hate extremism platform time,2
hat people like burning house get rid rat harry emerson fosdick hate burning,2
antithesis poem poetry poet audio art word wordsmith artist writer war hate love greedy greed,2
miss chenle scene anger fuck die hate,2
thank duke duchess sussex dedication end hate online especially important,2
trump death surge june dead million infect cultist covid rally no virus defense plan,2
trump death surge june dead million infect cultist covid rally no virus defense plan,2
certify curriculum technology prescribed doctor proud,2
administration go actually take action hate racism nothing fuel th,2
facebook continue make record set profit yet also continue ignore hate extremism platform time,2
many thing people along political ideological spectrum able agree aga,2
tzu hope may community protect keep safe hate,2
hope may community protect keep safe hate,2
urgent call action legislator interested party kill bill poli hate discrimination http,2
thank love hate snippet eye virg love love hate smile wave hater gonna hate,2
trump death surge june dead million infect cultist covid rally no virus defense plan,2
reset saturday question day hate love dead pool wolverine,2
jus ayin platform hate,2
yes yes yes rather connect people face book spread hate harassment see support digital sca,2
facebook continue make record set profit yet also continue ignore hate extremism platform time,2
call god listen people hate bitten zechar,2
another example facebook continue ignore hate platform along partner,2
simple twist poem poetry poet audio art word wordsmith artist writer hate love video,2
black brother sister see use democrat run nothing hate black life mat,2
facebook continue make record set profit yet also continue ignore hate extremism platform time,2
facebook continue make record set profit yet also continue ignore hate extremism platform time,2
reset saturday question day hate love dead pool wolverine,2
facebook continue make record set profit yet also continue ignore hate extremism platform time,2
facebook continue make record set profit yet also continue ignore hate extremism platform time,2
facebook continue make record set profit yet also continue ignore hate extremism platform time,2
trump effect racial division hate,2
bad search something overt produce countless group profile user,2
weird response gary lineker public figure voraciously publicises blac,2
sound right eh mean lie follow number know,2
okay give maybe perso,2
trump vote hate hate speech pro trump pro america freedom people good,2
nike hire leftist hate america make million play destroyed career,2
born win knew along could hear truth come every song,2
thank courage let hold leader accountable,2
hate disagreement love big difference hate disagreement disagree someone,2
time day fishing hip hop tour social distance form discrimination hate racism stay,2
weird response gary lineker public figure voraciously publicises blac,2
qp effective hate crime law vision forblack hate crime hate,2
facebook continue make record set profit yet also continue ignore hate extremism platform time,2
maga resistance epic wait see long take,2
facebook continue make record set profit yet also continue ignore hate extremism platform time,2
even staff super smash bros wiki discord server admit hate practice discontinue product,2
weird response gary lineker public figure voraciously publicises blac,2
trump death surge june dead million infect cultist covid rally no virus defense plan,2
thank courage let hold leader accounta,2
reset saturday question day hate love dead pool wolverine,2
weird response gary lineker public figure voraciously publicises blac,2
facebook continue make record set profit yet also continue ignore hate extremism platform time,2
even staff super smash bros wiki discord server admit hate practice discontinue product,2
facebook continue make record set profit yet also continue ignore hate extremism platform time,2
post online hate cost life israeli company offer way,2
facebook continue make record set profit yet also continue ignore hate extremism platform time,2
facebook continue make record set profit yet also continue ignore hate extremism platform time,2
easton lady red hate contagious encourage top usa embolden hat,2
facebook continue make record set profit yet also continue ignore hate extremism platform time,2
lady red hate contagious encourage top usa embolden,2
recent follower case know twatter bias hate conservative christian israel curren,2
recent follower case know twatter bias hate conservative christian,2
cover news last month blm protest riot antimasker racism hate,2
sorry no need anyone anything blm divisive racist marxist hate,2
thank duke duchess sussex dedication end hate online especially important,2
thank duke duchess sussex dedication end hate online especially important,2
people say hate strong word love people throw around like nothing team follow back,2
trump death surge june dead million infect cultist covid rally no virus defense plan,2
post online hate cost life israeli company offer way,2
online hate cost life israeli company offer way,2
trump death surge june dead million infect cultist covid rally no virus defense plan,2
john wayne reread racist comment soil legacy john wayne racist actor,2
weird response gary lineker public figure voraciously publi,2
pathetic sort attempt build street normal like pleb red beth rigby,2
trump death surge june dead million infect cultist covid rally no virus defense plan,2
thank duke duchess sussex dedication end hate online especially important,2
please explain difference blm antifa al qaeda hate demand,2
another example facebook continue ignore hate platform along partner,2
hate fact repeat hater kudos hardin simmons university college di,2
another example facebook continue ignore hate platform along partner,2
facebook continue make record set profit yet also continue ignore hate extremism platform time,2
assumption round would ask autograph,2
thank duke duchess sussex dedication end hate online especially important,2
facebook continue make record set profit yet also continue ignore hate extremism platform time,2
celebrity throw money violent rioter,2
think hater win life hate die inside win goal,2
tim scott know understand trump know lose trump wha,2
city mike cfb want every body good,2
answer trump hat accusati,2
hate group cleveland ohio,2
another example facebook continue ignore hate platform along partner,2
hate macedonian get canada exist no ethnic group subject cdn medium report,2
common man afraid hate police no action response catch android mobile theft gang technol,2
confederate monument confederate flag heritage hate nathan bedford forrest slave trader grand wizard kkk,2
sorry no need anyone anything blm divisive racist marxist hate,2
yes yes yes rather connect people face book spread hate harassment see support digita,2
thank duke duchess sussex dedication end hate online especially important,2
go trump divisive chaotic strategy no doubt trump knew would create buzz controv,2
another example facebook continue ignore hate platform along partner,2
facebook continue make record set profit yet also continue ignore hate extremism platform time,2
political figure like gop also pledge stop hate profit facebook platform month,2
another example facebook continue ignore hate platform along partner,2
listen pain struggle surrealism art artist conceptual art surrealism,2
beruit usa pain struggle surrealism art artist conceptual art surrealism,2
faceless authority figure pain struggle surrealism art artist conceptual art,2
fire soul pain struggle surrealism art artist conceptual art,2
block bigotry art artist conceptual art surrealism surreal art pain struggle hate,2
blood hand art artist conceptual art surrealism surreal art pain struggle,2
no justice no peace art artist conceptual art surrealism surreal art pain struggle,2
aftermath freedom pain struggle surrealism art artist conceptual art,2
one last lonely warrior pain struggle surrealism art artist conceptual art,2
trump fiddle pain struggle surrealism art artist conceptual art surrealism,2
hold back storm pain struggle surrealism art artist conceptual art,2
death shyster pain struggle surrealism art artist conceptual art surrealism,2
supporter antichrist pain stuggle surrealism art artist conceptual art,2
web weave pain struggle surrealism art artist conceptual art surrealism,2
face nation conflict pain struggle surrealism art artist conceptual art,2
diseased pain struggle surrealism art artist conceptual art surrealism surreal art,2
pain struggle surrealism conceptual art project art artist conceptual art,2
want see real hate look like look tweet real hater trend hashtag ripdo,2
reset saturday question day hate love dead pool wolverine,2
people hate cop ex con explains youtube,2
say no hate speech respect respect hate speech hate,2
make bad choice former life not excuse behaviour lack meaningful engagement,2
look like get mba university modi ji channel,2
another example facebook continue ignore hate platform along partner,2
black brother sister see use democrat run nothing hate black life mat,2
buddy penny speaks baptist church spread coronavirus hate email info,2
nice proof rick grenell one fine public servant ever,2
race hate fill karen video disturb watch seriously white america wtf problem,2
part six post tomorrow please let know think far rt like share thank,2
could give fly rat claim,2
another example facebook continue ignore hate platform along partner,2
clip live acoustic demo small mind george floyd ignorance hate among,2
reset saturday question day hate love dead pool wolverine,2
al bot argue,2
people say hate strong word love people throw around like nothing team follow back,2
long know hezbollah us dehumanize propaganda justify violence jew analysis,2
must extremely high tolerance lie hate bigotry racism treason ne,2
another example facebook continue ignore hate platform along partner,2
another example facebook continue ignore hate platform along partner,2
must extremely high tolerance lie hate bigotry racism treason,2
fuck hate word crush give shit crush hate dont like,2
scurlock amen maga ww wakeup america not give hate liberal anti fa black life,2
big question trump january february covid hit usa watc,2
facebook continue make record set profit yet also continue ignore hate extremism platform time,2
amen maga ww wakeup america not give hate liberal anti fa,2
another example facebook continue ignore hate platform along partner,2
black life matter leader call defunding police black people not trust politician,2
another example facebook continue ignore hate platform along partner,2
legalize cannabis state peace love unity heal america less gun hate racism,2
facebook continue make record set profit yet also continue ignore hate extremism platform time,2
thank duke duchess sussex dedication end hate online especially important,2
gonna want die hate rage thing,2
make bad choice former life not excuse behaviour lack meaningful engagement,2
moment come together silence hate loud black life matter,2
silent victim hate ignorance racism think fair st,2
another example facebook continue ignore hate platform along partner,2
another example facebook continue ignore hate platform along partner,2
orange hitler living name promote arian race policy hate separation vote nazi gop,2
call support rw party nothing hate demonstration,2
tell teach kid racism hate scary event talk reading book together ask question,2
another example facebook continue ignore hate platform along partner,2
starbucks pause paid advertising across social medium help stop hate speech via,2
another example facebook continue ignore hate platform along partner,2
another example facebook continue ignore hate platform along partner,2
another example facebook continue ignore hate platform along partner,2
starbucks pause paid advertising across social medium help stop hate speech via,2
political figure like gop also pledge stop hate profit facebook platform,2
another example facebook continue ignore hate platform along partner,2
another example facebook continue ignore hate platform along partner,2
facebook continue make record set profit yet also continue ignore hate extremism platform time,2
another example facebook continue ignore hate platform along partner,2
another example facebook continue ignore hate platform along partner,2
another example facebook continue ignore hate platform along partner,2
another example facebook continue ignore hate platform along partner,2
legalize cannabis state peace love unity heal america less gun hate,2
another example facebook continue ignore hate platform along partner,2
thank duke duchess sussex dedication end hate online especially important,2
best example hate crime,2
scumbag useless sack bigotry hate not win debate indoctrinate,2
reset saturday question day hate love dead pool wolverine,2
reset saturday question day hate love dead pool wolverine,2
black brother sister see use democrat run nothing hate black life mat,2
reset saturday question day hate love dead pool wolverine,2
another example facebook continue ignore hate platform along partner,2
another example facebook continue ignore hate platform along partner,2
venky nitikavi,2
another example facebook continue ignore hate platform along partner,2
first episode talk walk right side jessemorton matthew heimbach discus matthew life story,2
another example facebook continue ignore hate platform along partner,2
another example facebook continue ignore hate platform along partner,2
another example facebook continue ignore hate platform along partner,2
another example facebook continue ignore hate platform along partner,2
hate disease,2
another example facebook continue ignore hate platform along partner,2
another example facebook continue ignore hate platform along partner,2
facebook continue make record set profit yet also continue ignore hate extremism platform time,2
another example facebook continue ignore hate platform along partner,2
another example facebook continue ignore hate platform along partner,2
another example facebook continue ignore hate platform along partner,2
